{"authority":{"absenceBehavior":"typed-unavailable-with-core-fallback","bundleVerification":"required-before-observation","callerSuppliedFactsAllowed":false,"lifecycleIdentity":"generative-runtime-nonce","observationOwner":"target-runtime-adapter","providerTrustAdmission":"separate-sdk-117-requirement","sameNominalScopeInstanceReusable":false,"scopeTypes":["browser-module","php-process","php-request"],"staleTokenAuthority":false,"tokenBoundFacts":["artifact-sha256","bundle-digest","capability-id","lifecycle-kind","observed-bindings","provider-id","provider-version","runtime-nonce"],"tokenCacheable":false,"tokenScope":"declared-per-capability","tokenSerializable":false},"capabilities":[{"id":"calendar.badge.browser","optional":true,"probe":{"artifactMatch":"exact-sha256","conditionalFailure":"unavailable-not-partially-authorized","kind":"javascript-exports","requiredBindings":["js.calendar.badge","js.calendar.format-label"],"requiredNativeSymbols":["@acme/calendar.CalendarBadge","@acme/calendar.formatCalendarLabel"],"versionMatch":"exact"},"scope":"browser-module","target":"javascript"},{"id":"calendar.read.php","optional":false,"probe":{"artifactMatch":"exact-sha256","conditionalFailure":"unavailable-not-partially-authorized","kind":"wordpress-plugin-and-symbols","requiredBindings":["php.calendar.event.construct","php.calendar.event.title","php.calendar.list-events"],"requiredNativeSymbols":["Acme\\Calendar\\Event::__construct","Acme\\Calendar\\Event::title","Acme\\Calendar\\list_events"],"versionMatch":"exact"},"scope":"request","target":"php"}],"capabilitySetDigest":"8caac93ac59f7d95f0b62868543e3c1ba3c2a5eeb32e1405015e863c771a527a","capabilitySetId":"acme-calendar.capabilities","capabilitySetVersion":"1.0.0","contract":{"id":"acme-calendar.wp70","sha256":"19b375bbc4f6fcb817d0eca12ec6d25b522eab0ca805e9f09ec0cbe08712f964","version":"1.0.0"},"profile":{"catalogRevision":"wp70-release/catalog-v1","catalogSha256":"d86d1d887f1a3d8894831e3ec092201ee5caba57e88f4eeff59816d22dd9aa6e","id":"wp70-release"},"provider":{"artifactSha256":"923412beee77cce43964a12358bb099ac07014bd37973df9910de3ad15b9cabd","id":"acme-calendar","version":"2.4.1"},"schema":"wordpress-hx.adoption-capability.v1","schemaVersion":1}
